Sheet: 一.作業成果分析表
A1: 一.作業成果分析表
A2: 作業日期(起) | B2: 2022/1/1 | D2: 作業人員 | E2: 10員
A3: 作業日期(止) | B3: 2022/10/31 | D3: 作業人日 | E3: 357人日
A4: 工作地點 | B4: 東勢系統
A5: 現場作業分析 | B5: 作業績效分析 | D5: 作業績效分析
A6: 漏水復原率 | B6: -6.42 | C6: %/年 | D6: 項目 | E6: 計劃 | F6: 實際 | G6: 差異值 | H6: 達成率
A7: 漏水復原量 | B7: -1.52 | C7: m3/Km/年 | D7: 地下漏水件數 | E7: 67 | F7: 71 | G7: of:=[.F7]-[.E7] -> 4 | H7: of:=[.F7]/[.E7] -> 1.05970149253731
A8: 檢修後戶配水量 | B8: 0.82 | C8: CMD/戶 | D8: 檢漏管長(KM) | E8: 578 | F8: 657 | G8: of:=[.F8]-[.E8] -> 79 | H8: of:=[.F8]/[.E8] -> 1.13667820069204
A9: 檢漏速率 | B9: 3.9 | C9: Km/人日 | D9: 檢漏戶數(戶) | E9: 29441 | F9: 14808 | G9: of:=[.F9]-[.E9] -> -14633 | H9: of:=[.F9]/[.E9] -> 0.502972045786488
A10: 篩檢率 | B10: 100 | C10: % | D10: 檢漏水量(CMD) | E10: 4532 | F10: 7924.41 | G10: of:=[.F10]-[.E10] -> 3392.41 | H10: of:=[.F10]/[.E10] -> 1.74854589585172
A11: 確認失敗率 | B11: 10.31 | C11: % | D11: 檢漏效益(元) | E11: 9572763 | F11: 18566598 | G11: of:=[.F11]-[.E11] -> 8993835 | H11: of:=[.F11]/[.E11] -> 1.93952341659352
A12: 地下漏水發生率 | B12: 81.61 | C12: % | D12: 檢漏成本(元/CMD) | E12: 326 | F12: 95 | G12: of:=[.F12]-[.E12] -> -231 | H12: of:=[.F12]/[.E12] -> 0.291411042944785
A13: 檢漏統計 | D13: 檢漏成本(元/KM) | E13: 2390 | F13: 1149 | G13: of:=[.F13]-[.E13] -> -1241 | H13: of:=[.F13]/[.E13] -> 0.480753138075314
A14: 項目 | B14: 件數 | C14: 水量 | D14: 作業費用統計
A15: 地下漏水(管線) | B15: 35 | C15: 5822.33 | D15: 項目 | E15: 計劃 | F15: 實際 | G15: 差異值 | H15: 達成率
A16: 地下漏水(用戶) | B16: 36 | C16: 1699.44 | D16: 用人費 | E16: 775286 | F16: 550990 | H16: of:=[.F16]/[.E16] -> 0.710692570225697
A17: 地上漏水 | B17: 16 | C17: 402.64 | D17: 差旅費 | E17: 189400 | F17: 82800 | H17: of:=[.F17]/[.E17] -> 0.437170010559662
A18: 其它漏水 | B18: 0 | C18: 0 | D18: 其它事務費 | E18: 42666 | F18: 0 | H18: of:=[.F18]/[.E18] -> 0
A19: 合計 | B19: 87 | C19: 7924.41 | D19: 車輛維護費 | E19: 17734 | F19: 11650 | H19: of:=[.F19]/[.E19] -> 0.656930190594339
A20: 最小流量比較 | D20: 器具維護費 | E20: 46400 | F20: 54507 | H20: of:=[.F20]/[.E20] -> 1.17471982758621
A21: 檢修後 | B21: 18915.33 | C21: CMD | D21: 儀器折舊費 | E21: 94778 | F21: 0 | H21: of:=[.F21]/[.E21] -> 0
A22: 檢修前 | B22: 23111.11 | C22: CMD | D22: 誤費/加班費 | E22: 2720 | F22: 2487 | H22: of:=[.F22]/[.E22] -> 0.914338235294118
A23: 差異值 | B23: -4195.78 | C23: CMD | D23: 檢漏工具費 | E23: 0 | F23: 18065 | H23: of:=[.F23]/[.E23] -> 
A24: 差異率 | B24: -18.15 | C24: % | D24: 油料費 | E24: 308175 | F24: 34199 | H24: of:=[.F24]/[.E24] -> 0.110972661637057
D25: 合計 | E25: 1477159 | F25: 754698 | H25: of:=[.F25]/[.E25] -> 0.510911824658009
A26: 檢討及建議
A27: 1. 於1月初即因應東勢所緊急區域機動檢漏申請開始進場作業，惟機動檢漏完成後於2月底進場作業前水壓流量架設作業。 2.計畫檢出地下漏水案件67件，實際進場檢出地下漏水案件71件，較計畫多4件。 3.檢修前最小流量23111.11CMD，檢修後最小流量18915.33CMD，減少水量4195.78CMD，降低18.15%，檢漏績效優異。 4.本次作業前1-2月份2個月售水率66.71%，檢修後7-8月份2個月售水率88.97%，增加22.26%，績效優異。